[
 {
  "url": "https://rakesh-freshsales-ind-sep21.myfreshworks.com/crm/sales/sales-sequences/filters",
  "slug": "sequences-list",
  "title": "Sales sequences (empty state)",
  "screenshotPath": "pages/sequences-list/screenshot.png",
  "domSnapshotPath": "pages/sequences-list/dom-snapshot.md",
  "networkRequestsPath": "pages/sequences-list/network-requests.json",
  "consoleLogPath": "pages/sequences-list/console-log.txt",
  "links": []
 },
 {
  "url": "https://rakesh-freshsales-ind-sep21.myfreshworks.com/crm/sales/sales-sequences/contact/new",
  "slug": "sequence-new",
  "title": "Create sales sequence",
  "screenshotPath": "pages/sequence-new/screenshot.png",
  "domSnapshotPath": "pages/sequence-new/dom-snapshot.md",
  "networkRequestsPath": "pages/sequence-new/network-requests.json",
  "consoleLogPath": "pages/sequence-new/console-log.txt",
  "links": []
 },
 {
  "url": "https://rakesh-freshsales-ind-sep21.myfreshworks.com/crm/sales/sales-sequences/contact/new",
  "slug": "sequence-new-add-task-dialog",
  "title": "Add task step dialog",
  "screenshotPath": "pages/sequence-new-add-task-dialog/screenshot.png",
  "domSnapshotPath": "pages/sequence-new-add-task-dialog/dom-snapshot.md",
  "networkRequestsPath": "pages/sequence-new-add-task-dialog/network-requests.json",
  "consoleLogPath": "pages/sequence-new-add-task-dialog/console-log.txt",
  "links": []
 },
 {
  "url": "https://rakesh-freshsales-ind-sep21.myfreshworks.com/crm/sales/sales-sequences/contact/402000016478",
  "slug": "sequence-detail",
  "title": "Sequence detail",
  "screenshotPath": "pages/sequence-detail/screenshot.png",
  "domSnapshotPath": "pages/sequence-detail/dom-snapshot.md",
  "networkRequestsPath": "pages/sequence-detail/network-requests.json",
  "consoleLogPath": "pages/sequence-detail/console-log.txt",
  "links": []
 },
 {
  "url": "https://rakesh-freshsales-ind-sep21.myfreshworks.com/crm/sales/sales-sequences/filters",
  "slug": "sequences-list-with-data",
  "title": "Sales sequences (with data)",
  "screenshotPath": "pages/sequences-list-with-data/screenshot.png",
  "domSnapshotPath": "pages/sequences-list-with-data/dom-snapshot.md",
  "networkRequestsPath": "pages/sequences-list-with-data/network-requests.json",
  "consoleLogPath": "pages/sequences-list-with-data/console-log.txt",
  "links": []
 }
]