[
 {
  "url": "https://rakesh-freshsales-ind-sep21.myfreshworks.com/crm/sales/accounts/view/402015942758",
  "slug": "accounts-list",
  "title": "Accounts : Freshsales (My accounts, 15)",
  "screenshotPath": "pages/accounts-list/screenshot.png",
  "domSnapshotPath": "pages/accounts-list/dom-snapshot.md",
  "networkRequestsPath": "pages/accounts-list/network-requests.json",
  "consoleLogPath": "pages/accounts-list/console-log.txt",
  "links": []
 },
 {
  "url": "https://rakesh-freshsales-ind-sep21.myfreshworks.com/crm/sales/accounts/view/402015942759",
  "slug": "accounts-view-all",
  "title": "Accounts : Freshsales (All accounts, 15)",
  "screenshotPath": "pages/accounts-view-all/screenshot.png",
  "domSnapshotPath": "pages/accounts-view-all/dom-snapshot.md",
  "networkRequestsPath": "pages/accounts-view-all/network-requests.json",
  "consoleLogPath": "pages/accounts-view-all/console-log.txt",
  "links": []
 },
 {
  "url": "https://rakesh-freshsales-ind-sep21.myfreshworks.com/crm/sales/accounts/view/custom?q[]=name contains",
  "slug": "accounts-filter-name",
  "title": "Accounts filtered by Name",
  "screenshotPath": "pages/accounts-filter-name/screenshot.png",
  "domSnapshotPath": "pages/accounts-filter-name/dom-snapshot.md",
  "networkRequestsPath": "pages/accounts-filter-name/network-requests.json",
  "consoleLogPath": "pages/accounts-filter-name/console-log.txt",
  "links": []
 },
 {
  "url": "https://rakesh-freshsales-ind-sep21.myfreshworks.com/crm/sales/accounts/view/402015942759 (Add account drawer)",
  "slug": "accounts-add-form",
  "title": "Add account",
  "screenshotPath": "pages/accounts-add-form/screenshot.png",
  "domSnapshotPath": "pages/accounts-add-form/dom-snapshot.md",
  "networkRequestsPath": "pages/accounts-add-form/network-requests.json",
  "consoleLogPath": "pages/accounts-add-form/console-log.txt",
  "links": []
 },
 {
  "url": "https://rakesh-freshsales-ind-sep21.myfreshworks.com/crm/sales/accounts/<id>",
  "slug": "account-detail",
  "title": "Account : <name> : Freshsales (Overview)",
  "screenshotPath": "pages/account-detail/screenshot.png",
  "domSnapshotPath": "pages/account-detail/dom-snapshot.md",
  "networkRequestsPath": "pages/account-detail/network-requests.json",
  "consoleLogPath": "pages/account-detail/console-log.txt",
  "links": []
 },
 {
  "url": "https://rakesh-freshsales-ind-sep21.myfreshworks.com/crm/sales/accounts/<id>?tab=entity-card-detail",
  "slug": "account-details",
  "title": "Account details tab",
  "screenshotPath": "pages/account-details/screenshot.png",
  "domSnapshotPath": "pages/account-details/dom-snapshot.md",
  "networkRequestsPath": "pages/account-details/network-requests.json",
  "consoleLogPath": "pages/account-details/console-log.txt",
  "links": []
 },
 {
  "url": "https://rakesh-freshsales-ind-sep21.myfreshworks.com/crm/sales/accounts/<id>?tab=conversations",
  "slug": "account-conversations",
  "title": "Conversations tab",
  "screenshotPath": "pages/account-conversations/screenshot.png",
  "domSnapshotPath": "pages/account-conversations/dom-snapshot.md",
  "networkRequestsPath": "pages/account-conversations/network-requests.json",
  "consoleLogPath": "pages/account-conversations/console-log.txt",
  "links": []
 },
 {
  "url": "https://rakesh-freshsales-ind-sep21.myfreshworks.com/crm/sales/accounts/<id>?tab=recent-activities",
  "slug": "account-activities",
  "title": "Activities tab",
  "screenshotPath": "pages/account-activities/screenshot.png",
  "domSnapshotPath": "pages/account-activities/dom-snapshot.md",
  "networkRequestsPath": "pages/account-activities/network-requests.json",
  "consoleLogPath": "pages/account-activities/console-log.txt",
  "links": []
 },
 {
  "url": "https://rakesh-freshsales-ind-sep21.myfreshworks.com/crm/sales/accounts/<id>?tab=contacts",
  "slug": "account-contacts",
  "title": "Contacts tab",
  "screenshotPath": "pages/account-contacts/screenshot.png",
  "domSnapshotPath": "pages/account-contacts/dom-snapshot.md",
  "networkRequestsPath": "pages/account-contacts/network-requests.json",
  "consoleLogPath": "pages/account-contacts/console-log.txt",
  "links": []
 },
 {
  "url": "https://rakesh-freshsales-ind-sep21.myfreshworks.com/crm/sales/accounts/<id>?tab=deals",
  "slug": "account-deals",
  "title": "Deals tab",
  "screenshotPath": "pages/account-deals/screenshot.png",
  "domSnapshotPath": "pages/account-deals/dom-snapshot.md",
  "networkRequestsPath": "pages/account-deals/network-requests.json",
  "consoleLogPath": "pages/account-deals/console-log.txt",
  "links": []
 },
 {
  "url": "https://rakesh-freshsales-ind-sep21.myfreshworks.com/crm/sales/accounts/<id>?tab=files",
  "slug": "account-files",
  "title": "Files tab",
  "screenshotPath": "pages/account-files/screenshot.png",
  "domSnapshotPath": "pages/account-files/dom-snapshot.md",
  "networkRequestsPath": "pages/account-files/network-requests.json",
  "consoleLogPath": "pages/account-files/console-log.txt",
  "links": []
 },
 {
  "url": "https://rakesh-freshsales-ind-sep21.myfreshworks.com/crm/sales/accounts/<id>?tab=freddy",
  "slug": "account-freddy",
  "title": "Freddy AI insights tab",
  "screenshotPath": "pages/account-freddy/screenshot.png",
  "domSnapshotPath": "pages/account-freddy/dom-snapshot.md",
  "networkRequestsPath": "pages/account-freddy/network-requests.json",
  "consoleLogPath": "pages/account-freddy/console-log.txt",
  "links": []
 }
]